id,content,title,url,num_chars,topic
1,at first you might think it's a cold and it could be but covid 19 could escalate here's what you need to know according to the World Health Organization China joint mission on covid 19 as of February 20th 80 % of laboratory confirmed cases were mild to moderate 14% were severe and 6% were critical just to be clear a mild case of CO fit 19 is not like a mild cold the symptoms will still be pretty severe anything less than needing oxygen puts you in this category severe cases do need supplemental oxygen and critical ones are defined by respiratory or multi organ failure the symptoms treatments and timelines of having the disease vary depending on which category patients fall into so let's break down what having covid 19 looks like day to day for each level of severity it can take as few as 2 or as many as 14 days after being exposed to the novel coronavirus for the first symptom to develop this is when it might feel like a cold or the common flu many patients develop fevers early on the World Health Organization China joint mission saw that about 88 percent of people who had covid 19 had a fever another study out of China showed that while only 44 percent of patients had a fever on admission to a hospital 89 percent eventually developed one but there have been some cases that led with gastrointestinal symptoms diarrhea nausea vomiting and/or abdominal discomfort may appear a couple of days before respiratory symptoms this isn't the norm though because covid 19 is a respiratory disease that means for most patients the virus will start and end with the lungs in the early days of infection the virus invades lung cells specifically this can damage the cilia the hairlike projections that move around to keep Airways clear of mucous and debris when cells get infected they die and shed off adding to the debris and hindering your body's ability to keep stuff out of the lungs and trachea the inflammation causes damage and damage causes more inflammation and this cycle could continue until there's no healthy tissue left and inflammation might explain why a dry cough is one of the most common symptoms same goes for shortness of breath and phlegm production other symptoms that can appear around this time are fatigue sore throat headache joint or muscle pain chills and a runny nose by day five patients with pre-existing conditions might find that they have trouble breathing and it usually takes about seven days for a person to go to a hospital mild cases though usually clear up by this time but those with moderate to critical cases will have developed pneumonia which can range from non-life threatening to severe recovery time for these patients could be anywhere from a few days to weeks for some severe and critical cases though symptoms can escalate into acute respiratory distress syndrome a RDS is an illness that happens when fluid builds up in the lungs inflammation triggers a flood of immune cells that are meant to target the infection they're usually isolated to infected areas but sometimes the body goes overboard which is when the immune cells start killing anything in their path including healthy cells a RDS is often fatal in critical cases it can lead to respiratory failure requiring advanced life support and this is most likely when patients head to the ICU a RDS treatment includes supplemental oxygen and mechanical ventilation the goal is to get more oxygen into the bloodstream since the lungs can't when this treatment doesn't work the lungs are basically too flooded to get any oxygen into your bloodstream that's the cause of most covid 19 deaths and even when a patient survives this phase they could be left with permanent lung damage SARS punched holes and some infected people's lungs giving them a honeycomb effect and these lesions have been seen in people affected by the novel coronavirus too early studies found that most people who die of the disease will do so within 14 to 19 days and on average people who recover are released from the hospital after two and a half weeks but with the most critical cases recovery could take months once a patient is in the recovery period it's possible that they could still be contagious these people should work with their doctors and public health officials to determine when they're no longer a risk as of now there is no vaccine for the virus so the best way to avoid getting sick is to avoid being exposed covid 19 spreads easily from person to person through coughing and sneezing so wash your hands often and avoid close contact with people who are sick and clean and disinfect surfaces that you use daily ghovat 19 should be taken seriously but most cases are survivable so stay home stay clean and don't panic,What_Coronavirus_Symptoms_Look_Like_Day_By_Day,https://www.youtube.com/watch?v=OOJqHPfG7pA,4725,general
2,"This novel coronavirus pandemic has truly affected all of us across the globe, but one of the hardest hit communities has been healthcare frontline workers. This means doctors, nurses, CMAs, respiratory therapists, technicians, custodial staff, and so many more. Today I'd like to take a focus and celebrate doctors, in memory of those who've laid down their lives in the battle against COVID-19. I sat down, and I interviewed over 100 physicians to get their take, their experiences, and learn their perspectives about the coronavirus. Know that all the revenue generated from this video, AdSense, donations, and even merch sales, link down below, are all going to the CDC Foundation to help continue this battle against COVID-19. The first question I asked these doctors, what do you think is not getting enough attention? - I wish there was more credit and awareness being given to other members of the healthcare teams, aside from just the doctors and the nurses. - Techs, transporters, housekeeping, kitchen staff, valets, operators. - X-ray, laboratory, radiology techs, EMT, janitorial staff. - Cafeteria workers, the respiratory therapists, the nurses, and everyone else here on the frontline is towards our abilities to do our jobs. - The number of doctors and healthcare professionals out there who have gotten seriously ill, even lost their lives fighting this disease. - Some healthcare workers have been disciplined for speaking up about the lack of personal protective equipment. - Testing is an area we need a huge amount of focus on and attention on in the UK. - We need antibody tests. We need to know who has immunity. - In many communities, the small number of cases being reported is simply a reflection of lack of testing. - How coronavirus is and will affect certain communities, our homeless community, our community of people with special needs. - The domestic abuse and domestic violence that is happening during a pandemic with victims being in the same home as perpetrators for longer periods of time in this quarantine. - We've limited and cut the number of visits a woman can have before she delivers. - Visitors, family, really no one is allowed to be at the bedside when you're infected with COVID. - If you look closely, you will see that there are young people, who are otherwise well, who can get seriously ill. - We can't really see the emotional toll that the outbreak has on us. - The effect that this is all having on our mental health and well-being. - Mental health problems don't stop just because we are having an infectious-disease pandemic. - I've had patients who haven't been able to get cancer surgery, who've had significant heart problems and not been able to get them worked up. - If people who now feel sick from cancer are now discouraged from going to hospitals because all the attention now is on COVID-19, then we're gonna miss some of those patients. - Right now we're postponing all the non-urgent cases, and when things are lifted, we're gonna see everyone come back all at once. - How is one supposed to date in this point in time? Are we just supposed to get to know people by Zoom and FaceTime? - Yeah, virtual dating is a thing now. For my next question, I asked, what does it mean for you to be a doctor now? - It means a 30-minute decontamination routine before I get to hug my kids every time I come home from the hospital. - Practicing medicine during this pandemic means what it always means, protecting the vulnerable. - This is a once-in-a-lifetime opportunity to boldly fulfill my oath and desire to save lives. - The COVID-19 pandemic has me in a place where I have never felt more connected to my profession. - I have an opportunity to step up and really honor my oath. - I really feel like it's a privilege for me to be able to practice medicine during the pandemic. It allows me to serve my community when my community needs me most. - I'm old enough to have lived through the early years of the AIDS epidemic, and it had a similar feeling. You knew you were in the middle of something incredibly important. - My mother gave me a magnet a long time ago that said, ""Not all heroes wear capes. ""Some of them wear stethoscopes."" - I'm not running away from it. I'm running toward it. - We're ready, we signed up for this, we took an oath. - It's a privilege to be a part of the solution. - It's an honor to care for patients and their families and to help navigate them through these very challenging times. - Medicine is a calling and a vocation. I've never viewed it as a job. - This isn't a job. This is a calling. - I couldn't agree more. Next I asked, how have you been personally affected by the coronavirus? - When we put a breathing tube in for a patient, which we have to do for almost every surgery, we're really exposed to everything that's in that patient's mouth or throat or airway. It's like looking down the barrel of a gun. - I'll be moving out of our house soon and into some place that's closer to the hospital and where I won't risk infecting my own family. - Should I move out, should I isolate within the home? - I haven't seen my mom or my dad or any family members in the last few weeks. - I have some sick family members. I don't know when I'll see them next. - I wasn't able to kiss my wife on our anniversary this year because of coronavirus. - My beautiful wife and I are about to bring new life into this world, and with that comes fear, worry, and anxiety. - Both of my daughters work with me here at the Cleveland clinic. I'm worried for the family, but we're gonna do this. - My entire family lives and practices a self-care survival simile, and when I read in the news that 2,027 physicians, as of yesterday, have contracted the virus and many have died from it, it gave me chills. - I recently got sick with a lot of the features of COVID-19. Without testing, I've got no way of knowing if I had it for sure. I don't know if I'll be infected again. I don't know if I'm going to infect my patients. - I did get corona. I was actually sick for two weeks, had pneumonia, and it was probably the worst health experience that I have ever been through. - I developed a fever and a lot of the COVID symptoms. When I ended up in the emergency room, all I could think about was when I recover, will this make me immune so I can get back out there? - For the first time ever, lately, I've been having the sense of uneasiness as I drive into work. - I've personally seen a lot of death that I don't know if residency could ever prepare you for. - Because our pain clinics closed down last week, and before I'll be transitioning to telemedicine soon, there's still a gap where I will be unemployed as a pain management fellow, and that leaves me financially unstable. - So I'm still paying rent, overhead, staff, supplies, all of the above with basically no income. - I'm a physician on O'ahu, and it's challenging caring for my neighbor island patients on Maui and the Big island. - Hydroxychloroquine has been getting a lot of press during this pandemic, and the availability of this medication has been a big concern for myself and for my patients. - I've been forced to delay important heartbeat and heart rhythm procedures for several of my patients. - I lost childcare, so my toddler keeps barging into all of my appointments, and that's probably a HIPAA violation. - Hey, I can relate. Bear walks into some of my patient visits too. Next I asked, how can we help from home? - Believe it or not, not everyone is taking social distancing seriously. - The virus doesn't spread on its own. People spread the virus, so you are on the frontline in this pandemic. - Even small indulgences, like going to a park around other people, can have huge consequences that you don't even feel in the moment. - Treat every outside contact as something potentially infected, no matter how healthy or safe someone or something looks. - This thing does not care what you look like, how much money you have, or how wealthy you are, so you have to stay home. - No cheating. I know it gets really boring at home sometimes, and all you want to do is just be with your friend just for a minute, but please, for our sake, stay home. - Stay home. That's how you fight the virus. - Get comfortable, and stay there. Netflix and chill. YouTube and thrill. - Please, please, please stay home. Help us help you. - Help me help you. - Stay hydrated, get some sleep, eat healthy, don't smoke, and please do some exercise while you're at home. - Here's my prescription for you. Stay home. - We are not stuck at home. We are safe at home. - Safe at home, not stuck at home. And please treat everyone with kindness. - Everyone knows someone who is putting their life at risk by working during these difficult times. Just send them a thank you. - Continue sending positive vibes and continue reaching out to those who are in their support system. We need their help. - And just be kind to each other. Everyone's having a hard time. - Physical distancing is crucial, but it should not cause social isolation. - Call or FaceTime your friends, your family, your significant others. - The virus mainly infects through mucus membranes of the eyes, nose and mouth, so even if we wear gloves and we wear masks, if we touch our face, we can still get infected. - Washing your hands, and no I'm not just talking like oh, wash, wash, wash, and you're done. I'm talking a full 20 seconds. - Wash your hands. - Wash your hands multiple times throughout the day. - Really diligent hand washing. - Wash your hands. - And as I say to my five year old, don't pick your nose. - Be wary of the browsers and the pickers at the grocery store. You know I'm talking about, those people that are picking up avocados and putting them right back. - By being very careful of your internet hygiene because spreading false information can be deadly. - Everyone has a role to play in making sure that we spread correct information. - Stop spreading misinformation on social media. I think this is very important. - Just following credible media outlets. Don't give in to the hysteria. - The top thing on my mind, is remembering to stay flexible and lean into uncertainty. - Have those difficult end-of-life discussions. You will feel at peace knowing your loved one's wishes, whether the time comes tomorrow or a decade from now. - Ask neighbors to put up a red piece of paper in their window if they need assistance immediately. A yellow piece means I need help, but not urgently. And green means things are okay. - And please know that when the scientists are saying these things, we're not saying them because we're out to get you. We're saying them because we care about you. - That's right. We're on team you. All right, my final question, what gives you hope? - It gives me goosebumps when I think about what you see around you. - The doctors, nurses, social workers, respiratory therapists, environmental services. - Each and every one of us is doing what we can. - It's the fact that I have a great ICU team. I have the best ICU nurses in the world. - The unity, the compassion, and empathy. - Humanity exists, and we're all in this together. - I live in New York City, and every night at 7:00, the entire city breaks out in cheer and applause for all the healthcare workers. (crowd cheering and applauding) - I'm hearing from families who are having more family meals, more family meetings, they're playing board games, they're communicating, they're talking. - People are coming together, and they are helping out their neighbors. - Letters like this in my mailbox from my neighbor, spreading love across this country. - Every patient that I called, the first thing they asked is how was I doing. - The outpouring of love and support from communities all around the world, showing their support for healthcare workers, like me, on the frontline. - All of our frontline workers, in hundreds of roles, inside the hospital and outside of it, working their tails off every single day. - My trainees all stepping up to volunteer to help in the ICU. - Healthcare professionals everywhere are stepping up instead of backing down. - The emergency department staff, now more than ever. - We've put aside all turf wars and inter-departmental bickering. - The fact that the world has set aside its differences to work on novel treatments, vaccines, and drugs for this virus. - The people donating and making supplies. - Like when we see businesses that stop their work and start producing equipment for healthcare providers. - Even famous fashion designers, like Chanel and Christian Siriano are making masks and gowns. - The numbers are getting better. Prevention does work. - Seeing people on their balconies applauding those on the frontline gives me hope. And seeing science working, creating vaccines, creating treatments is what gives me hope. - I'm fighting for the hope that one day, very soon, we overcome this, that we get back to normal life and don't take the small things for granted again.",Doctors Tell You The TRUTH About Battling Coronavirus.txt,https://www.youtube.com/watch?v=WhHfjsOl8Tc,6442,
3,"As the pandemic continues - variants have become the latest concern with notable examples detected in South Africa, Brazil and the UK. But variants are complicated. Each one is made up of a collection of mutations, all of which have the potential to change the SARS-CoV-2 virus in unexpected ways. So what do scientists mean when they talk about variants and what might this mean for the future of the pandemic? Viruses multiply by copying their genomes over and over. But like an old photocopier, these copies aren’t always perfect. Each of these imperfect copies is a variant. Normally the imperfections or mutations don’t change how the virus behaves and they can often make it less successful than the original strain. But very rarely mutations can change the virus in some important ways. It could become more infectious, or more able to avoid the immune system. The more a virus is allowed to replicate unchecked, the more chance it has to accumulate these rare beneficial mutations. That can occur when viruses are allowed to spread quickly through a population, or if they encounter a host that’s less able to fight them, such as people with compromised immune systems from medical treatment or those who are HIV+. If a particular set of mutations makes a variant more successful, it might become more prominent than others and that’s when it gets noticed. Epidemiologists may even decide to label it a ‘variant of concern’, like the examples identified in Brazil, South Africa and the UK. For months, scientists have been striving to work out what’s changed in these variants, and what those changes mean. Because a variant spreading doesn’t necessarily mean that it has an advantageous mutation. For example a small number of people could, by chance, move a variant from one region to another, like tourists travelling back from popular vacation spots. This could cause that variant to start spreading in a new location even though there may be no significant change to the biology of the virus. This is called the Founder Effect. Understanding why a variant has emerged requires a combination of studies. Epidemiology can help detect and trace new variants and flag new or worrying patterns of infection. Meanwhile lab studies can start to pinpoint how the mutations are changing the properties of the virus. And studies like these are starting to identify mutations that have given the virus an upper hand. Some variants are faster spreading, and there are hints that certain mutations could start to weaken or even evade natural and vaccine derived immunity. For example, the D614G mutation, known to virologists as Doug, spread widely in the early days of the pandemic and can be seen in almost all variants. It affects the spike protein that coronavirus particles use to penetrate cells. A mutation in the genome changes one amino acid for another, and makes the new variant more infectious than the original virus. N501Y also known as Nelly, is another spike protein mutation which appears to be associated with increased transmissibility. This mutation has been detected in the B.1.1.7, B.1.351 and P.1 strains - all variants of concern. The worry of so-called ‘immune escape’ has also been hinted at with another spike protein mutation, E484K or Eek. Eek has been spotted in B.1.351 and P.1, the variants detected in South Africa and Brazil. Lab studies in early in 2021 showed that the variant could evade some virus-blocking antibodies, while trials in South Africa suggested that the variant reduced the efficacy of several vaccines. Despite these worries, the coronavirus is actually mutating very slowly compared to something like influenza and it seems like the vaccines developed so far will remain at least partly effective. But scientists are still taking the threat posed by variants seriously. And there are several things that can be done to help tackle it. Firstly, to do anything researchers need data - it’s very important to monitor and trace the emergence of variants and that isn’t always simple to do. Organisations like the COVID-19 Genomics UK consortium, or COG-UK, have stepped up their efforts to combine fast sequencing with efficient data sharing. COG-UK has already sequenced over 400,000 SARS-CoV-2 genomes. Next, researchers need to look forward to how these mutated viruses could affect global vaccination efforts. Existing vaccines can be redesigned and combinations of vaccines are also being tested but it could be difficult to perform reliable clinical trials amid the ongoing vaccination programmes. Right now though, work needs to continue at a national level. Public health policies such as track and trace, social distancing and vaccine roll-outs are powerful tools to interrupt transmission and keep tabs on new variants. After all, every time the virus is prevented from spreading, it's also prevented from mutating, nipping new variants in the bud before they even have a chance to develop. ",Coronavirus variants_ What you need to know,https://www.youtube.com/watch?v=B8UEZ9cfgz4,4950,
